{
  "slug": "outlook",
  "name": "Microsoft Outlook",
  "version": 1,
  "lastVerified": "2026-10-28",
  "tagline": "Register a Microsoft Entra app for Outlook and plug it into Composio. No review, but work tenants often need their admin's consent.",
  "appType": "Entra ID app registration",
  "composio": {
    "toolkit": "outlook",
    "managedAvailable": true,
    "authScheme": "OAuth2",
    "callbackUrl": "https://backend.composio.dev/api/v3/toolkits/auth/callback"
  },
  "facts": {
    "handsOnMinutes": {
      "min": 12,
      "max": 25
    },
    "approvalWait": null,
    "review": "none",
    "cost": {
      "usdPerYear": 0,
      "asStated": "Free. Publisher verification and its prerequisites have no charge.",
      "summary": "Free"
    }
  },
  "steps": [
    {
      "id": "composio-account",
      "title": "Set up your Composio account",
      "who": "you",
      "minutes": {
        "min": 2,
        "max": 3
      },
      "optional": true,
      "when": "Skip if you already have a Composio project and API key.",
      "instructions": [
        "Sign up from the Composio login page.",
        "Open Settings → API keys and copy a key.",
        "Save it as COMPOSIO_API_KEY where your agent runs.",
        "Stay in this project. Auth configs belong to one project."
      ],
      "fields": [
        {
          "label": "Env var",
          "value": "COMPOSIO_API_KEY"
        }
      ],
      "actions": [
        {
          "label": "Sign up",
          "url": "https://dashboard.composio.dev/login"
        },
        {
          "label": "API keys",
          "url": "https://dashboard.composio.dev/~/project/settings/api-keys"
        }
      ],
      "sources": [
        "composio-quickstart",
        "composio-dashboard-nav"
      ],
      "checks": [
        "composio-dashboard-login",
        "composio-api-keys-page"
      ],
      "problems": [
        {
          "q": "I can't find the API keys page",
          "a": [
            "Open the API keys link above after signing in. It opens Settings → API keys for your current project.",
            "If you have several projects, switch to the one you'll use for this agent first."
          ],
          "sources": [
            "composio-quickstart"
          ]
        }
      ],
      "contacts": [
        "composio-discord"
      ]
    },
    {
      "id": "choose-tenant",
      "title": "Choose the tenant that owns the app",
      "who": "you",
      "minutes": {
        "min": 1,
        "max": 1
      },
      "instructions": [
        "Use a work account in your company's Microsoft Entra tenant with at least the Application Developer role.",
        "Avoid a personal Microsoft account. Apps registered with one can't be publisher verified.",
        "The app can't move to another tenant later. Pick the tenant your company will keep."
      ],
      "warnings": [
        {
          "text": "Publisher verification also rejects *.onmicrosoft.com publisher domains. Your tenant needs a DNS-verified custom domain.",
          "sources": [
            "ms-pv-overview"
          ]
        }
      ],
      "sources": [
        "ms-register",
        "ms-pv-overview"
      ]
    },
    {
      "id": "register-app",
      "title": "Register a new app",
      "who": "you",
      "minutes": {
        "min": 3,
        "max": 5
      },
      "instructions": [
        "Open the Microsoft Entra admin center → Entra ID → App registrations → New registration.",
        "Enter a Name. Users see it on the consent screen. You can change it later.",
        "Supported account types: pick Any Entra ID Tenant + Personal Microsoft accounts. Covers work and outlook.com users.",
        "Business users only? Pick Multiple Entra ID tenants. Single tenant blocks everyone outside your org.",
        "Under Redirect URI, choose platform Web and paste the Composio callback below.",
        "Click Register. Copy the Application (client) ID from Overview.",
        "No Redirect URI field, or skipped it? Open Authentication → Add Redirect URI → Web."
      ],
      "fields": [
        {
          "label": "Name",
          "value": "Your product name",
          "hint": "Shown to users on the consent screen",
          "copy": false
        },
        {
          "label": "Supported account types",
          "value": "Any Entra ID Tenant + Personal Microsoft accounts",
          "hint": "Older UI: Accounts in any organizational directory and personal Microsoft accounts",
          "copy": false
        },
        {
          "label": "Redirect URI platform",
          "value": "Web",
          "copy": false
        },
        {
          "label": "Redirect URI",
          "value": "https://backend.composio.dev/api/v3/toolkits/auth/callback",
          "hint": "Case-sensitive. Must match your Composio auth config exactly"
        }
      ],
      "warnings": [
        {
          "text": "Redirect URIs are case-sensitive. Paste the callback exactly as shown.",
          "sources": [
            "ms-reply-url"
          ]
        }
      ],
      "actions": [
        {
          "label": "Open Entra admin center",
          "url": "https://entra.microsoft.com/"
        }
      ],
      "sources": [
        "ms-register",
        "ms-redirect",
        "ms-accounts-validation",
        "composio-outlook-auth"
      ],
      "checks": [
        "entra-admin-center",
        "oidc-common",
        "composio-callback"
      ],
      "problems": [
        {
          "q": "AADSTS50011: the redirect URI doesn't match",
          "a": [
            "The app has no Web redirect URI equal to the one Composio sent.",
            "Open Authentication and add the Composio callback under the Web platform, exactly as shown above."
          ],
          "sources": [
            "ms-error-codes",
            "ms-redirect"
          ]
        },
        {
          "q": "AADSTS50194: app isn't configured as a multitenant application",
          "a": [
            "You registered the app as single tenant, so the shared /common sign-in endpoint refuses it.",
            "Change Supported account types to a multi-tenant option."
          ],
          "sources": [
            "ms-error-codes",
            "composio-outlook-auth"
          ]
        },
        {
          "q": "Personal outlook.com accounts can't sign in",
          "a": [
            "The app only allows organizational accounts.",
            "Switch Supported account types to Any Entra ID Tenant + Personal Microsoft accounts."
          ],
          "sources": [
            "ms-register",
            "ms-accounts-validation"
          ]
        }
      ]
    },
    {
      "id": "client-secret",
      "title": "Create a client secret",
      "who": "you",
      "minutes": {
        "min": 1,
        "max": 2
      },
      "instructions": [
        "In your app, open Certificates & secrets → Client secrets → New client secret.",
        "Add a description and pick an expiry. Maximum is 24 months. Microsoft recommends under 12.",
        "Click Add, then copy the Value column, not the Secret ID.",
        "The Value is shown once. Store it in a secret manager, never in git.",
        "Set a reminder before it expires. Microsoft then rejects it with AADSTS7000222."
      ],
      "fields": [
        {
          "label": "Expires",
          "value": "12 months",
          "hint": "Custom lifetimes are capped at 24 months",
          "copy": false
        }
      ],
      "warnings": [
        {
          "text": "Microsoft recommends certificates over secrets in production. Composio's Outlook OAuth config takes a client secret.",
          "sources": [
            "ms-credentials",
            "composio-outlook-auth"
          ]
        }
      ],
      "sources": [
        "ms-credentials",
        "composio-outlook-auth"
      ],
      "checks": [
        "token-wrong-secret"
      ],
      "problems": [
        {
          "q": "AADSTS7000215: Invalid client secret provided",
          "a": [
            "Usually the Secret ID was pasted instead of the Value. Microsoft's own error says so.",
            "Paste the Value into your Composio auth config. If you no longer have it, create a new secret."
          ],
          "sources": [
            "ms-error-codes",
            "ms-credentials"
          ]
        },
        {
          "q": "AADSTS7000222: the client secret keys are expired",
          "a": [
            "Your secret passed its expiry date.",
            "Create a new secret, update your Composio auth config, then delete the old secret."
          ],
          "sources": [
            "ms-error-codes"
          ]
        },
        {
          "q": "I closed the page before copying the Value",
          "a": [
            "You can't view it again. Create a new client secret on the same page.",
            "Delete the unused one so it doesn't linger."
          ],
          "sources": [
            "ms-credentials"
          ]
        }
      ]
    },
    {
      "id": "api-permissions",
      "title": "Add delegated Graph permissions",
      "who": "you",
      "minutes": {
        "min": 2,
        "max": 4
      },
      "instructions": [
        "In your app, open API permissions → Add a permission → Microsoft Graph → Delegated permissions.",
        "Add offline_access, Mail.Read and Mail.Send. User.Read is already there.",
        "Add more only for tools you use, e.g. Mail.ReadWrite, Calendars.ReadWrite, Contacts.ReadWrite.",
        "Click Add permissions.",
        "Don't pick Application permissions. They cover every mailbox in a tenant and always need admin consent.",
        "Grant admin consent for <your tenant> only covers your own tenant, not your users' tenants."
      ],
      "fields": [
        {
          "label": "Starter permissions",
          "value": "offline_access User.Read Mail.Read Mail.Send",
          "hint": "Delegated. Trim or extend to match your Outlook tools"
        }
      ],